{
  "SCHEMA_VERSION": "1.0.0",
  "INCIDENT_ID": "INC-PROJECT-YYYY-NNNN",
  "PROJECT_ID": "PROJECT_ID",
  "REPOSITORY": "owner/repository",
  "TARGET_SCOPE": "PROJECT",
  "TARGET_VARIANT": null,
  "SEVERITY": "P0",
  "STATE": "DETECTED",
  "PRODUCTION_BASE_SHA": "REQUIRED_LIVE_PRODUCTION_SHA",
  "AFFECTED_PRODUCTION_VERSION": null,
  "DISCOVERED_AT": "REQUIRED_ISO8601_TIMESTAMP",
  "TEMPORARY_MITIGATION": {
    "APPLIED": false,
    "TASK_ID": null,
    "BRANCH": null,
    "SHA": null,
    "DEPLOYMENT_EVIDENCE": [],
    "ROLLBACK_PLAN": null
  },
  "ROOT_CAUSE_STATUS": "UNKNOWN",
  "ROOT_CAUSE_SUMMARY": null,
  "PERMANENT_FIX_REQUIRED": true,
  "PERMANENT_FIX_TASK_ID": null,
  "PERMANENT_FIX_TARGET_VERSION": null,
  "PERMANENT_FIX_SHA": null,
  "REGRESSION_TEST_REQUIRED": true,
  "REGRESSION_TEST_EVIDENCE": [],
  "CARRY_FORWARD_TO_FUTURE_RELEASES": true,
  "RELEASE_GATE_STATE": "OPEN",
  "NOTES": null
}
